{
  "schema_version": "ecc.agent-architecture-audit.report.v1",
  "schema_origin": {
    "kind": "LOCAL_FORMALIZATION_OF_SKILL_EXAMPLE",
    "skill_ref": "C:/Users/Tudonghoa/.codex/plugins/cache/ecc/ecc/2.2.3/skills/agent-architecture-audit/SKILL.md#report-schema",
    "upstream_validator_status": "NOT_SUPPLIED",
    "local_schema_ref": "contracts/audit-report.schema.json",
    "limitation": "Schema cục bộ formal hóa shape ví dụ công khai trong skill và thêm provenance/status rõ ràng. Chưa được kiểm bằng validator máy đọc upstream ECC vì chưa được cung cấp; không tuyên bố upstream certification."
  },
  "executive_verdict": {
    "overall_health": "high_risk",
    "primary_failure_mode": "Static review thấy memory admission/recall theo user, model paths chưa có bằng chứng sole gateway, tool requirement còn prompt-only và missing usage bị đổi thành zero. Đây là rủi ro thiết kế/mã trong phạm vi đã đọc, không phải kết luận có sự cố/rò dữ liệu production đã tái hiện.",
    "most_urgent_fix": "Trước mở AI M1, dùng company-bound memory và code-enforced gateway/scope/cap/evidence gate; tiếp nhận khách deterministic vẫn chạy. Không thay runtime đang chạy trong nhiệm vụ thiết kế."
  },
  "scope": {
    "target_name": "Quanlycongviec AI paths / BOS V3.1a D6 design boundary",
    "model_stack": [
      "OpenAI chat-completions trong aiConversation/aiReplyDraft; gpt-4o-mini là code default, chưa kiểm model live",
      "Guide CopilotKit/AI SDK có primary model và mood/intent/librarian calls; config live chưa xác minh",
      "Paperclip/OpenClaw là adapter đích trong thiết kế; báo cáo này không kiểm runtime invocation live"
    ],
    "layers_to_audit": [
      "system_prompt",
      "session_history",
      "long_term_memory",
      "distillation_and_recall",
      "tool_selection_and_execution",
      "tool_interpretation",
      "answer_shaping_and_transport",
      "hidden_repair_and_auxiliary_calls",
      "persistence"
    ],
    "baseline_sha": "fe3f4398ebf2186596c108a7570f83e3bbef104a",
    "review_mode": "STATIC_READ_ONLY_DESIGN_REVIEW",
    "review_date": "2026-10-16",
    "live_tests": "NOT_RUN",
    "scope_limitation": "Đọc có mục tiêu các helpers aiConversation/aiUserMemory, aiReplyDraft module/provider/policy, guideStepGuard/guideExperience/CopilotKit và tests/eval liên quan. Không runtime exploit, không gửi dữ liệu khách/model call, không chứng minh mọi path trong toàn repo đã kiểm. Mã nguồn không thay bằng chứng SHA/config đang deploy."
  },
  "original_audit_reconciliation": {
    "status": "UNKNOWN",
    "referenced_original_count": 9,
    "original_report_status": "NOT_FOUND_IN_SCOPED_SEARCH",
    "diagram_assessment_status": "ORIGINAL_TEN_FIX_ASSESSMENT_NOT_FOUND",
    "mapping": [],
    "search_scope": [
      "Tên file Downloads liên quan BOS/BUSINESS_AI/V3.1/V2.3/audit/đánh giá/kiến trúc",
      "Tên file và nội dung docs repo liên quan agent/audit; cụm 9 phát hiện, 9 findings, 10 điểm, ecc.agent-architecture-audit.report",
      "Markdown/JSON/text/HTML liên quan trong Downloads; V3.1 PDF text extract đã có"
    ],
    "limitation": "Brief có nhắc audit gốc 9 phát hiện và bản đánh giá 10 sửa sơ đồ nhưng chưa tìm được nguồn gốc trong phạm vi đọc. Chín finding L7-L01..L7-L09 là review bổ sung local, không mặc định tương ứng chín finding gốc; không thể giữ/hạ/nâng/đóng finding gốc trước khi có nguyên bản và map bằng chứng."
  },
  "findings": [
    {
      "finding_id": "L7-L01",
      "original_finding_id": null,
      "status": "PARTIAL_CONTROL_DESIGN_GAP",
      "severity": "high",
      "title": "External conversation chưa có typed taint xuyên luồng draft",
      "mechanism": "Draft service đọc Messenger content, anonymize rồi chuyển user string cho model. Prompt/regex validation có ích nhưng input/output ở ranh giới đọc chưa mang typed taint/authority lineage để bảo đảm văn bản nguồn ngoài chỉ là dữ liệu.",
      "source_layer": "system_prompt / tool_interpretation",
      "root_cause": "Trust boundary đang dựa một phần vào vị trí prompt và policy text thay vì typed trust/scope/provenance contract được service kiểm.",
      "evidence_refs": ["backend/src/modules/aiReplyDraft/service.js:32", "backend/src/modules/aiReplyDraft/service.js:44", "backend/src/modules/aiReplyDraft/service.js:61", "backend/src/modules/aiReplyDraft/policy.js:23"],
      "confidence": 0.95,
      "recommended_fix": "Receiver gắn taint/source refs, propagate qua summary/recall; model đọc ngoài ở C0, structured extraction chỉ proposal; action đi L5/L6 với scope/evidence/cap độc lập. Giữ anonymize/no-send hiện có và bổ sung injection fixture.",
      "scope_limit": "Không thấy exploit; draft path đã có validation/no-send nên không kết luận model hiện có thể tự gửi khách từ path này."
    },
    {
      "finding_id": "L7-L02",
      "original_finding_id": null,
      "status": "OPEN_STATIC_FINDING",
      "severity": "high",
      "title": "Memory user-only chưa đạt company-bound contract",
      "mechanism": "Persist/load memory helper lọc user_id và inject facts vào system prompt. Trong các hàm đã đọc không có company/tenant key, nên một user tham gia nhiều scope không được các hàm này tự cô lập memory theo D6.",
      "source_layer": "long_term_memory / persistence",
      "root_cause": "Memory admission/lookup key thiếu company_scope; recalled user facts được nối trực tiếp vào privileged prompt context.",
      "evidence_refs": ["backend/src/helpers/aiUserMemory.js:203", "backend/src/helpers/aiUserMemory.js:208", "backend/src/helpers/aiUserMemory.js:311", "backend/src/helpers/aiUserMemory.js:317", "backend/src/helpers/aiConversation.js:601", "backend/src/helpers/aiConversation.js:604"],
      "confidence": 0.99,
      "recommended_fix": "Scope memory/session/cache theo tenant+company trước retrieval; user đổi company mở phiên mới; quarantine memory thiếu scope, không fallback kho chung; admission/correction giữ provenance và policy.",
      "scope_limit": "Static gap không chứng minh dữ liệu hai công ty thực tế đã bị trộn/rò. Không đọc dữ liệu khách hoặc thử truy cập chéo scope."
    },
    {
      "finding_id": "L7-L03",
      "original_finding_id": null,
      "status": "OPEN_STATIC_FINDING",
      "severity": "high",
      "title": "Tool-required report có đường trả lời không gọi tool",
      "mechanism": "Prompt yêu cầu in nguyên tool report, nhưng vòng gọi dùng tool_choice auto và trả narrative khi choice không có tool_calls. Không có gate tại nhánh trả này buộc verified report/claim phải trỏ execution/evidence đúng mốc.",
      "source_layer": "tool_selection / tool_execution",
      "root_cause": "Yêu cầu dùng tool là chỉ dẫn ngôn ngữ; response protocol chưa cưỡng chế evidence cho loại câu trả lời cần nguồn.",
      "evidence_refs": ["backend/src/helpers/aiConversation.js:60", "backend/src/helpers/aiConversation.js:83", "backend/src/helpers/aiConversation.js:190", "backend/src/helpers/aiConversation.js:633", "backend/src/helpers/aiConversation.js:647", "backend/src/helpers/aiConversation.js:651"],
      "confidence": 0.99,
      "recommended_fix": "Route intent cần số liệu/action-result qua code tool/evidence gate; deterministic renderer dùng typed tool result; thiếu execution receipt phải NEEDS_INPUT/UNVERIFIED, không công bố claim đã làm.",
      "scope_limit": "Không yêu cầu mọi greeting/narrative luôn gọi tool. Finding áp dụng report/claim mà business contract yêu cầu nguồn."
    },
    {
      "finding_id": "L7-L04",
      "original_finding_id": null,
      "status": "PARTIAL_CONTROL_DESIGN_GAP",
      "severity": "high",
      "title": "Nhiều model paths chưa có bằng chứng sole gateway/atomic shared cap",
      "mechanism": "Draft path đọc usedToday/checkBudget rồi gọi provider; aiConversation gọi provider trực tiếp; guide có model call phụ. Các đường này chưa chứng minh tất cả đều reserve atomically dưới một cap L10 và không thể đi direct egress.",
      "source_layer": "tool_execution / hidden_repair_loops",
      "root_cause": "Nhiều wrapper có budget/call control cục bộ nhưng chưa có contract và enforcement một chủ cho mọi call/retry/reviewer/subagent.",
      "evidence_refs": ["backend/src/modules/aiReplyDraft/service.js:54", "backend/src/modules/aiReplyDraft/service.js:57", "backend/src/modules/aiReplyDraft/service.js:61", "backend/src/modules/aiReplyDraft/provider.js:36", "backend/src/helpers/aiConversation.js:625", "backend/src/routes/guide/copilotkit.js:320", "backend/src/routes/guide/copilotkit.js:345"],
      "confidence": 0.98,
      "recommended_fix": "Inventory mọi primary/auxiliary/retry/reviewer path, gateway reserve-before-call và settle UNKNOWN, deny provider egress/credential bypass cho runtime. Chuyển từng đường với cutoff/fencing, không tự sửa runtime trong lượt thiết kế.",
      "scope_limit": "Chưa kiểm network policy/config runtime hoặc tuyên bố mọi call live đang vượt cap; đây là thiếu bằng chứng enforcement toàn tuyến theo yêu cầu đích."
    },
    {
      "finding_id": "L7-L05",
      "original_finding_id": null,
      "status": "OPEN_STATIC_FINDING",
      "severity": "high",
      "title": "Missing provider usage bị đổi thành zero",
      "mechanism": "Provider trả prompt/completion token0 khi usage field thiếu/không safe integer. Service chấp nhận số nguyên không âm và tính/persist cost từ đó, làm thiếu usage có thể thành chi phí0 thay PENDING_RECONCILIATION.",
      "source_layer": "persistence / tool_interpretation",
      "root_cause": "Không tách usage certainty khỏi giá trị token; default0 hợp thức hóa thông tin chưa có bằng chứng.",
      "evidence_refs": ["backend/src/modules/aiReplyDraft/provider.js:50", "backend/src/modules/aiReplyDraft/provider.js:51", "backend/src/modules/aiReplyDraft/provider.js:52", "backend/src/modules/aiReplyDraft/service.js:63", "backend/src/modules/aiReplyDraft/service.js:67", "backend/src/modules/aiReplyDraft/service.js:75"],
      "confidence": 0.99,